pid	date	house_code	house_no	debate_section_topic	debate_section_id	contribution	order_in_discourse
#EndaKenny	2017-05-23	dail	32	Leaders' Questions	dbsect_2	In any event, the Deputy's comments about primary care centres are in the context of a full programme of primary care centres being provided throughout the country. The theory is that people will be able to go to primary care centres to have medical needs which do not require treatment in accident and emergency departments dealt with and that this will help to reduce overcrowding in accident and emergency departments. When primary care centres are up and running they are required to be staffed and to have GPs available. There is little point in building them if they are going to be closed at 5 p.m.. The theory is that a person should be able to go to a primary care centre on a 24-hour basis, as is the case in so many other countries. This issue forms part of the discussions which the Minister for Health is having with the GPs in terms of their contracts and the types of facilities that they require in primary care centres. According to the HSE TrolleyGAR system this morning, there were 331 patients on trolleys in acute hospitals nationally. While this causes distress to patients, their families and to front-line services, the recent data indicates that the national situation is improving, with approximately 5% fewer patients waiting on trolleys at the end of April this year as compared with the same period last year. Notwithstanding this improvement, these figures are still too high and the Department is working assiduously with the HSE to identify measures to reduce overcrowding in our hospitals and to provide key improvement measures that will continue to reduce trolley numbers and improve patient experience. Several hospitals were under pressure this morning, including the Mater Hospital, Beaumont Hospital, St. Luke's General Hospital, Kilkenny, Letterkenny General Hospital and University Hospital Waterford. Lessons have been learned over the last number of years. The winter initiative introduced in an effort to reduce emergency department overcrowding, in respect of which an additional €40 million was provided, brought about an improvement. Lessons have been learned from that and will be implemented into the future. A range of practical measures were included in that initiative, including the provision of 90 additional beds, aids and appliances for approximately 5,000 patients, 1,000 additional home care packages and 615 additional transitional care bed approvals. In regard to the particular issue raised by Deputy Mattie McGrath, I will ask the Minister to follow up on the matter for him.	spk_44
#EndaKenny	2017-05-23	dail	32	Leaders' Questions	dbsect_2	There is nothing wrong with Tipperary or its people but I am sure they are a little disappointed after Sunday.	spk_46
#EndaKenny	2017-05-23	dail	32	Leaders' Questions	dbsect_2	They will try to come back at the Reds the next time.	spk_48
#EndaKenny	2017-05-23	dail	32	Leaders' Questions	dbsect_2	We are at the job a long time.I will ensure that the Minister for Health, Deputy Harris, comes back to the Deputy about the particular issue he raised. When facilities are provided, either by the taxpayer or through PPPs, they are provided for a particular purpose. It is up to management to make them work in the best interests of all the people by giving the best level of service. I take the Deputy's point.	spk_50
#EndaKenny	2017-05-23	dail	32	Leaders' Questions	dbsect_2	If all the facilities are there, they should be made to work in the interests of people. I will ensure that the matter is followed up with the Minister for Health.	spk_52
#EndaKenny	2017-05-23	dail	32	Leaders' Questions	dbsect_2	This is an important subject. The Government has prioritised disability by appointing Deputy Finian McGrath as Minister of State at the Department of Health to sit at the Cabinet table and articulate the concerns and anxieties relating to this area on a regular basis. Disability funding has increased over the past year and early intervention services and services for school-age children with disabilities need to be improved and organised more effectively. This process is well under way and the HSE is engaged in reconfiguring its therapy resources into geographically-based teams for children aged from birth to 18. The objective of the new model of assessment and intervention is to provide a single, clear referral pathway for all children, irrespective of the disability they have, where they live or the school they attend, as evidence shows that is an important element of progress. Some €8 million in additional funding was invested in 2014-2015 in order to provide 200 additional posts to support the implementation of that model. A further €4 million in additional funding was allocated in respect of 75 therapy posts in 2016 and it is expected that as this reconfiguration of services takes place it will have a significant impact on the HSE's ability to meet the needs of children and young people in a much more efficient, effective and equitable manner. In 2013, 260 front-line primary care staff positions were approved.That included 52 occupational therapists and 52 speech and language therapists. The aim is for that recruitment to continue which will lead to a reduction in waiting lists and times. A further €4 million was provided in that regard in 2014. Since the June 2007 commencement of Part 2 of the Disability Act 2005, the HSE has endeavoured to meet its legislative requirements as specifically referred to by Deputy Healy. The number of applications for assessment under the Act has increased each year since it was introduced. It is anticipated that in excess of 6,000 applications will be received this year. It can take a significant period to determine accurately the nature of a disability which a child might have. Although there has been continual investment in this area, there are significant challenges in meeting the statutory timeframes which apply to the assessment of needs process. The Minister of State at the Department of Health, Deputy McGrath, is dealing with the delay in assessments. He is trying to resolve those delays by direct consultation. There is an ongoing recruitment campaign to combat the issue of staff shortage. The Minister of State is working with the HSE to deal with this in order that the requirements of the Act can be met by the HSE and there are no delays beyond the period for assessment and determination of a disability.	spk_54
#EndaKenny	2017-05-23	dail	32	Leaders' Questions	dbsect_2	It is not acceptable for any State agency to be outside the legal requirements of what it has to do. The Minister of State at the Department of Health, Deputy McGrath, who has special responsibility for disability issues, sits at the Cabinet table, has a substantial budget and is working assiduously to deal with this issue. If there are 6,000 assessments to be carried out this year, more than 100 must take place each week. Many of these assessments are quite complex and take a period of time to assess accurately.	spk_56
#EndaKenny	2017-05-23	dail	32	Leaders' Questions	dbsect_2	As the Deputy knows, parents have every right to know the nature and scale of the disability that their child or children may have to deal with. The Act itself-----	spk_58
#EndaKenny	2017-05-23	dail	32	Leaders' Questions	dbsect_2	There has been much collaboration between the health and education sectors on the issue of children's disability. That is facilitated by the cross-sectoral team and the implementation of the Disability Act. That team comprises representatives of the Department of Health, the Department of Education and Skills, the Department of Children and Youth Affairs, the HSE executive, the National Council for Special Education and the National Educational Psychological Service. As Deputy Healy is aware, a detailed report was compiled by Mr. Eamon Stack, chairman of the National Council for Special Education, which sets out a progressive way of dealing with the issue. While waiting lists are unacceptable and should not exist, the Minister of State is at the forefront of dealing with the delays. In the near future, it is hoped the law in terms of assessment for children will be fully complied with, unlike the current situation where children have to wait for longer than they should.	spk_61
#EndaKenny	2017-05-23	dail	32	Manchester Arena Bombing: Expressions of Sympathy	dbsect_3	This is very distressing. On behalf of the Government and, while the President is away, all of the people of Ireland I would like to extend our deepest sympathy to the people of Great Britain on the dreadful attack which took place in Manchester last night. The atrocity is made all the more appalling by its deliberate targeting of young people and families, the targeting of innocence and enjoyment, as they began to make their way home from the Manchester Arena. For those who have had the opportunity, and indeed privilege, of bringing their children to a concert like this, the excitement goes on for months beforehand. It is a huge adventure for young people and young children. We think of parents who bring their children to a concert venue and leave them outside to go in and participate in the adventure. To think that some of them last night never came back and never will come back is appalling. What was potentially a night of absolute enjoyment was transformed into a nightmare in which at least 22 people have lost their lives and so many others have been injured. These are reminders of the depravity of the views of a few. These beliefs have no place in our society. I spoke with the Tánaiste and the Garda Commissioner early this morning about the situation. I was due to speak to the Prime Minister about other matters earlier this morning but we have rescheduled that conversation for later on this evening. Our embassy had its lines open all night in London and the Minister for Foreign Affairs and Trade, Deputy Flanagan, and Ambassador Dan Mulhall have been available to offer any assistance that is appropriate. COBRA, the security briefing committee, met this morning with the Prime Minister chairing it. Our security levels here are monitored very carefully by the Tánaiste, the Garda Commissioner and the Garda authorities. That level remains at moderate, which means an attack is possible but not likely. The situation for people around the country is that we have a very detailed level of shared information with other countries. The reason that this level has not been increased in Ireland is that we do not have any evidence of it being beyond the moderate stage. That is not the situation in Great Britain, where evidence of planned attacks exists. The Prime Minister speaks for the British Government in that respect. Last night's attack is a reminder that no one is immune from those whose hatred of our values drives such evil acts. I assure the public that all the necessary measures are being taken by our authorities here to counteract such deadly threats. The Garda authorities will continue to work very closely with our UK and EU counterparts and other countries in responding to the threat of international terrorism and violence inspired by extremists. There can never be any justification for the brutal inhumanity displayed in Manchester last night. The number of children caught up in these events makes it particularly hard to bear for all of those involved. Our thoughts and prayers are obviously with the victims and their families and all of those who are affected by this atrocity. People in our country are heartbroken by this. The city of Manchester has such exceptionally close ties with this country for so many reasons over so many years. We support them absolutely. Listening this morning to the Mayor of Manchester, and the Mayor of Liverpool whose children were at this concert last night, gives us a sense of how a predetermined atrocity can impact in so many ways and cause such devastation for families.I will speak to Prime Minister May later this evening in respect of any details of which we should be aware and any assistance our Government, people and agencies can offer the British people at this time.	spk_63
#EndaKenny	2017-05-23	dail	32	Order of Business	dbsect_4	I do not object to Deputy Martin's request. It would be good if, at an appropriate time, Members had an opportunity to contribute to a debate on disabilities and hear directly from the Minister of State, Deputy McGrath, regarding the efforts and improvements being made in this area. I will be happy to facilitate Deputy Martin.	spk_76
#EndaKenny	2017-05-23	dail	32	Order of Business	dbsect_4	The Deputy makes the point that this is a matter of rights. While it is a matter of rights, it is also a matter of procedures and follow through. We could have ratified the convention without being able to fulfil what it means. In this country, we have always taken the view that we deal with the legislation, put it through and implement it and then ratify conventions so that we can stand over them and say we ratified a convention because the necessary legislation was in place. I have answered questions in the House about this issue for a number of years. A suite of legislation had to be passed. Believe me, the Minister of State, Deputy McGrath, has raised this matter at Cabinet on a number of occasions and we are coming close to reaching a conclusion. That is the story. I will have the Minister of State respond to the House on this matter. It is not a case of dragging heels but getting the legislation through properly - the last piece of it is quite sensitive - and then ratifying the UN convention in order that we can stand over it.	spk_78
#EndaKenny	2017-05-23	dail	32	Order of Business	dbsect_4	Deputy Burton is well aware from her time as a Minister of what happens here. These are recommendations from the European Commission. Obviously, the Government takes these things into account but as we speak, the Ministers for Finance and Public Expenditure and Reform are meeting in Brussels with the European Investment Bank about the very issue of infrastructure in order that a proposition can be put forward by which funding and a stream of income resulting from major pieces of infrastructure can be put forward. Elements of that would be, for instance, the metro for Dublin or, for instance, the major motorway required from Cork to Limerick, in respect of which a stream of income would come to fund loans for those propositions and more to follow. Deputy Burton is well aware that there is a €42 billion programme for infrastructural investment here. The review of the capital programme out to 2021 is currently under way. The AIB situation has been referred to by the Minister for Finance on many occasions, a Cheann Comhairle. That is a paper exercise. When the testing of the 25% share sale is gone through, that will be used for debt reduction. The Commission is entitled to make its views known, as it has. It has made its views known on Apple and it has made its views known on other things, but the Government would be very careful to manage prudently our economic affairs in the interests of our people-----	spk_80
#EndaKenny	2017-05-23	dail	32	Order of Business	dbsect_4	-----leaving us room to have infrastructure development. Deputy Burton does not want a situation in which we have an oversupply of money going into it, where construction inflation results and where developers reap the rewards. We need to have a balance between what we put in and the output that we get.	spk_82
#EndaKenny	2017-05-23	dail	32	Order of Business	dbsect_4	Gabh mo leithscéal.	spk_84
#EndaKenny	2017-05-23	dail	32	Order of Business	dbsect_4	I do not want to comment on court announcements made in respect of any particular case.	spk_88
#EndaKenny	2017-05-23	dail	32	Order of Business	dbsect_4	The judgment will be given tomorrow, the jury has not been discharged and I do not wish to make any comment, or cannot make any comment, on that. Obviously, in terms of party politics, there are contests that take place at different times for positions of responsibility. The Government has a programme here, and we refer to that programme, which is set out and agreed, for support both from inside Government and from outside Government. One of the issues that has arisen in respect of the Garda, for instance, is for it to have access to the Workplace Relations Commission, WRC, and the Labour Court. The legislation that is being drafted for that will take into account some serious matters that need to be considered, one of which is what the Deputy refers to, but that is an element of what Government is doing here and willing to do in respect of giving the members of the Garda full representation and hearing at the WRC and the Labour Court. There are consequences and there are issues that need to be dealt with, and they must be addressed in some detail when the Bill comes before the House.	spk_90
#EndaKenny	2017-05-23	dail	32	Order of Business	dbsect_4	That Bill is currently going through the House and is due for a Second Stage debate here tomorrow. I am sure that Deputies from all over the House and different parties will have their opportunity to have their say in detail about this.	spk_92
#EndaKenny	2017-05-23	dail	32	Order of Business	dbsect_4	This is being taken on Private Members' tomorrow evening, as Deputy Connolly is aware. Caranua is an independent statutory body that provides a range of approved services in the areas of health and personal social services, education and housing services for applicants. It began accepting applications from former residents in January 2014. It has expended some €60 million in support of 4,000 individuals.	spk_94
#EndaKenny	2017-05-23	dail	32	Order of Business	dbsect_4	Yes. The Minister, Deputy Bruton, announced a consultation on-----	spk_96
#EndaKenny	2017-05-23	dail	32	Order of Business	dbsect_4	-----proposed draft terms of reference for a review of eligibility for Caranua.	spk_98
#EndaKenny	2017-05-23	dail	32	Order of Business	dbsect_4	Maybe the Minister might like to respond to the particular question that Deputy Connolly raised.	spk_100
#EndaKenny	2017-05-23	dail	32	Order of Business	dbsect_4	This is an important issue for the patients and the families involved. It is not just a question of general legislation. I will have the Minister respond directly to the Deputy.	spk_103
#EndaKenny	2017-05-23	dail	32	Order of Business	dbsect_4	Deputy Ó Broin raises an important point. Obviously, others have had reductions, but we do not hear about those too often. The heads of this Bill were cleared in April by Government. There has been quite a deal of discussion between the Attorney General's office and the Department. I expect that when the Bill comes before the House and is cleared for discussion, that the intent will be to have a comprehensive response to a situation that I know causes difficulties where increases in rates occur.	spk_106
#EndaKenny	2017-05-23	dail	32	Order of Business	dbsect_4	It is not a matter of legislation. There has been a substantial increase in the number of planning permissions applied for and granted, and these apply in all cases. Clearly, local authorities and the transport authority have an issue in respect of more exits on national routes. We have had occasions in the past where roads have lost their national secondary or primary status because of the incidence of new exits - traditionally through section 4 notices - given that there is a matter of road safety involved where that happens. That is a matter for discussion between local authorities and the transport authority. In respect of the planning guidelines, obviously, any couple or individual applying for planning permission in the Deputy's county or anywhere else goes through a preplanning discussion with their local authority. It is not national guidelines that are imposed in the vast majority of cases. This can be seen in the rate of increase in the number of planning applications applied for and approvals granted, which is substantial.	spk_108
#EndaKenny	2017-05-23	dail	32	Order of Business	dbsect_4	The Minister for Public Expenditure and Reform is in Brussels today. I am sure he will have no objection to a discussion on the mid-term capital review, in respect of which work is under way.	spk_111
#EndaKenny	2017-05-23	dail	32	Order of Business	dbsect_4	I think these are publicly available in any event but I do not expect the Minister will have any objection to that.	spk_113
#EndaKenny	2017-05-23	dail	32	Order of Business	dbsect_4	Given that these are matters of public issue in any event, I do not see any reason for secrecy about priorities that are deemed important by Ministers. I will have that matter taken up with the Minister for Public Expenditure and Reform.	spk_115
#EndaKenny	2017-05-23	dail	32	Order of Business	dbsect_4	The Deputy raises two issues. One is in respect of the Bill, which is on Committee Stage in the Seanad. While it has not yet come to the Dáil, it will do so in due course. Obviously, Members will have an opportunity to voice their opinions on it. The second point the Deputy raises relates to the statistics that are produced. In the context of statistics involving the Garda Síochána, there is an analysis going on in respect of another element of the statistics, which I expect will be quite detailed, and that can be followed through with regard to these statistics also. Unfortunately, domestic violence is an issue in Ireland. It causes havoc for families and family relationships, with a particularly dramatic and traumatic impact on children.	spk_117
#EndaKenny	2017-05-23	dail	32	Order of Business	dbsect_4	That is not a matter for legislation; it is a matter for decision by the Minister for Agriculture, Food and the Marine. I will have him respond to Deputy Collins. He is well aware of the details of the matter.	spk_119
#EndaKenny	2017-05-23	dail	32	Order of Business	dbsect_4	"I agree that farmers went out of their way to attempt to deal with the consequences of these fires. I deplore the actions of those who started these fires in the first instance. They were obviously unable to contain what happened afterwards and this resulted in massive destruction to property, assets and value, and also in terms of the impact on wildlife and nature in so many ways. For those who have been victimised by these acts of arson, if that is what they were, we cannot expect them to have the State suddenly say, ""You are responsible for this yourself"". If the land is blackened and the trees burned and if people's assets are decimated, I think it is an issue that needs to be looked at with some degree of compassion and consideration. It is a valid point and we will consider it very carefully."	spk_122
#EndaKenny	2017-05-23	dail	32	Order of Business	dbsect_4	The intention was that the scheme would be operational and effective from September of this year. The heads of the Bill and the general scheme were approved by the Government on 20 January 2017. The joint Oireachtas committee met on 8 February for pre-legislative scrutiny and its report was received on 23 February. On 22 February, the Department of Children and Youth Affairs received formal notification from the Office of the Parliamentary Counsel that a draftsperson was assigned specifically to work on the affordable childcare scheme Bill. The Office of the Parliamentary Counsel and the Department of Children and Youth Affairs started work together on the drafting of the Bill in March and this work is ongoing. No date is yet confirmed for when the drafting of the Bill will be complete. Nonetheless, the Government is conscious of the position and wants to make arrangements so that payments under the scheme will become effective in September. This is quite a complicated Bill and the timeline is tight, but it is hoped it can be met.	spk_124
#EndaKenny	2017-05-23	dail	32	Order of Business	dbsect_4	The intention here is clear. I will have the Minister, Deputy Bruton, respond directly to the Deputy.	spk_126
#EndaKenny	2017-05-23	dail	32	National Economic and Social Council	dbsect_6	I propose to take Questions Nos. 1 to 6, inclusive, together. The Cabinet committee on infrastructure, environment and climate action has met on five occasions since it was reconstituted in June 2016. The last meeting of the Cabinet committee took place on 15 May 2017. The next meeting of the Cabinet committee will be scheduled shortly.  My Department provides the secretariat to the Cabinet committee on infrastructure, environment and climate action and chairs the associated senior officials' group. The Cabinet committee oversees the development and delivery of key infrastructure and associated policy, including oversight of relevant commitments in A Programme for a Partnership Government. In addition, the committee addresses the climate change challenge in terms of domestic policy and in relation to Ireland's EU and international obligations.	spk_133
