pid	date	house_code	house_no	debate_section_topic	debate_section_id	contribution	order_in_discourse
#LeoVaradkar	2024-01-23	dail	33	Church-State Relations	dbsect_5	That is definitely not a model that we will be following. In the election we will be encouraging people not to vote for Sinn Féin or for left wing parties precisely because that is what they want to do in Ireland. It is not a good thing. On long Covid, early in the pandemic the HSE identified a need for a national service for long Covid and to set up a multidisciplinary team to develop a model of care under the auspices of the chief clinical officer. The model of care is now being implemented building on existing service provision in addition to establishing new services across GP and community services and acute hospitals, to ensure a national service is in place for those who need it. Funding for the model of care has been increased to €6.6 million this year. At present there are six long Covid clinics and seven post-acute Covid clinics that are operating nationally. The clinics currently operate at St. Vincent's and Beaumont and the post-acute Covid clinics operating under the new model of care will be in the Mater and Connolly Hospital in Blanchardstown. In addition, Tallaght, St. James's Hospital, CUH, UHG and Limerick hospitals are operating combined post-acute and long Covid clinics. The HSE is working with Letterkenny to have a more definitive timeline around their anticipated launch date. Recruitment, which includes consultants in the areas of infectious disease, respiratory medicine, psychiatry, neurology and allied health professionals, clinical psychologists and administrators, is under way. To date 66 WTE primary notification numbers have been issued across all of the post-acute and long Covid clinics. As of 8 September last year, 46 whole-time equivalent posts had been followed. Deputies will appreciate that long Covid is an emerging area of medicine and expertise. There is still so much that we do not know about it.	spk_132
#LeoVaradkar	2024-01-23	dail	33	Church-State Relations	dbsect_5	I will be consulting with the Opposition parties on Thursday and am happy to go through it all then.	spk_134
#LeoVaradkar	2024-01-23	dail	33	Church-State Relations	dbsect_5	Like public representatives generally, I meet church leaders informally from time to time in the course of attending official or public events. The most recent formal meeting between the Office of the Taoiseach and the church leaders took place on 15 April 2021, when the now Tánaiste met the leaders of all the Christian churches, including the Roman Catholic Church, the Church of Ireland, the Presbyterian Church, the Methodist Church and the Irish Council of Churches. I had the opportunity to meet the papal nuncio shortly before Christmas. I understand that discussions at these forums covered the contribution to peace-building and the work churches undertake on an ongoing basis at community level in Northern Ireland in particular.	spk_136
#LeoVaradkar	2024-01-23	dail	33	Church-State Relations	dbsect_5	I thank the Deputies for their questions. On Deputy Tóibín's question, I put on the record that the Government is very grateful for and recognises the work done by the religious in Ireland and all over the world. Given the scandals that have affected churches and religious bodies and given the existence of religious extremism in the world, sometimes that can be forgotten, but it should not be forgotten. We will all know of people - nuns, priests and other religious people - who have made an enormous contribution to society and have given their lives, essentially, to help others. We have see that in healthcare, education, housing, addiction services and poverty alleviation, for example. It is easily forgotten that when the State was founded 100 years ago, we did not have a Department of social welfare and we did not have a Department of Health. Most people at the time did not consider these things to be matters for the State. It was often left to voluntary and religious bodies to fill that gap. Of course, things have changed so much since then. We intend to get the safe access zones Bill enacted this year. I have not had any engagement with religious leaders on it specifically, although the last meeting I participated in was in 2021 and that was quite some time ago at this stage. It certainly was not raised with me by the papal nuncio or by the Archbishop of Dublin. I am going to have to seek an update from the Minister on Saint John of God. I am aware of some of the issues facing the organisation, but I am not fully up to date.I am sure these things will be resolved by negotiation - they always are - but I will seek an update from the Minister on it today, given the Deputies have raised it. In respect of education about trans people, trans people exist. They have always existed. Now they can be more open about it, which is a good thing, but we have a long way to go. It is my view that it is right that children should learn about people who are transgender and what that means. I would prefer it if children learned about these things from their teachers in their schools rather than in the schoolyard, and from their loving parents rather than the Internet. If we do not have education in schools, I think we are letting children down in that regard. Trans healthcare is a new and evolving area of medicine. It is controversial and there is a lot of disagreement within the profession about what the right treatments, diagnoses and investigations should be. There is so much we do not know about it; we are still learning. It is very important that NGOs should be consulted but, as with any area of healthcare, it has to be based on science and not on politics. It has to be led by science. I say that as somebody who is an LGBT advocate and a member of the LGBT community. Really, healthcare has to be led by science, not by politics.	spk_142
#LeoVaradkar	2024-01-23	dail	33	Economic Policy	dbsect_6	I propose to take Questions Nos 1 to 7, inclusive, together. The National Competitiveness and Productivity Council published its annual competitiveness challenge report in September 2023. The council's report outlined 19 priority recommendations across a broad range of areas for Government consideration. These include enabling stronger productivity growth through research, development and innovation; reducing the cost of doing business in Ireland; accelerating progress on the usage and generation of energy in line with our climate targets; and significantly improving planning, development and the delivery of infrastructure. On 29 November last year, the Government published a comprehensive formal response to the council's recommendations. This is the fourth year in which a formal response was issued by the Government to the competitiveness challenge report. This response was co-ordinated by my Department, drawing together material from all relevant Departments. In its response, the Government welcomed the advice and views of the council and agreed on the importance and relevance of its recommendations to Ireland's continuing competitiveness. The response outlines specific actions underway across different Departments in answer to each of the recommendations of the council. These include, for example, a national industrial strategy for offshore wind to be published in the first half of the year; more efficiency and certainty in the planning system through the enactment of the Planning and Development Bill 2023; the provision of additional resources to An Bord Pleanála and local authorities; greater use of modern methods of construction, MMC, in the construction of housing; an updated Pathways to Work strategy to be published shortly reflecting current labour market challenges; and stronger pathways from schools into further education and training and apprenticeships. These are just a few examples of actions the Government is taking to ensure continued improvements in the competitiveness and productivity of the Irish economy in the years ahead.	spk_106
#LeoVaradkar	2024-01-23	dail	33	Economic Policy	dbsect_6	I thank the Deputies for their questions. Deputy Boyd Barrett is quite right to say that wealth is generated by workers, but there are different forms of workers and different forms of wealth. A lot of wealth is generated by innovation and creating new things. We need to always bear that in mind. There is a lot of research showing that 75% of all new global growth in recent decades has been driven by innovation, new inventions and entrepreneurship, that is, not by people doing the same things, but by people doing new things. On the issue of skilled people leaving the country, Deputy Boyd Barrett is absolutely correct; there are skilled people leaving the country for lots of different reasons. There are way more skilled people coming into the country every year. There is net migration of skilled people into Ireland and that has been the case for a very long time. As I pointed out earlier, even if it is narrowed down to just Irish citizens, 80,000 left in the past three years but 90,000 returned. Notwithstanding the high cost of housing and the high cost of living, skilled people are pouring into this country because of the jobs that are available and more Irish citizens are returning to the country than are leaving. These are just the facts. On what we can do to make housing more affordable, increasing incomes is a big part. It is the ratio of incomes to house prices that matters the most. The help-to-buy scheme helps great numbers of people to get their deposit for their first home. The derelict properties grants help a lot too. It is good to see dereliction now falling. The first home scheme makes a big difference in closing the affordability gap. There is also the construction of much more social housing because social housing benefits everyone, not just those who are taken off the housing list as a result of getting homes. It also helps to bring down the cost of housing generally and makes more places available to rent. I took a look at the SCSI report that is being reported on today. Unfortunately, I believe its findings have been misreported. I can understand why people misunderstood it. The SCSI specifically states that the first home scheme is not included in its calculations.That would close the affordability gap. Indeed, it would eliminate it in many cases. It only applies to three-bedroom new semi-detached homes. Most people do not buy three-bedroom new semi-detached homes. Most people buy homes that are not new and most first-time buyers tend to buy two-bedroom, rather than three-bedroom, properties. As is often the case with these reports, it has been incorrectly reported by elements of the media and then incorrectly quoted by politicians, which is regrettable but happens very regularly. As regards Deputy Murphy's comments, we are not planning to introduce an Internet tax. That was one option of many considered by the working group. The disadvantages were clear. It would not just be a 1% or 2% levy, but would have to be €10 or €15 a month, which would be too high, and there would be huge difficulties in applying exemptions, which we currently apply to people on very low incomes and to pensioners, for example. It did not jump out of the report as a good option. Rather, it jumped out of the report as a not-very-good option, but it is always important to consider all options. As regards Deputy Moynihan's comments, as I acknowledged earlier, the cost of doing business is very high and it is rising, particularly for the hospitality sector and very labour-intensive sectors, such as retail, for example. We are seeing many cafés and restaurants closing. There are many of them opening, too, and a lot that are very difficult to get into, have a lot of business and are very busy. We are not seeing any evidence yet of employment levels falling in the hospitality sector but we need to monitor and watch out for that very closely. As I have said before, there is no point putting up people's wages if the net result is they lose their job or have their hours cut. We are not seeing much evidence of that yet. In terms of businesses struggling, help is on the way. A quarter of a million euro will be injected into small businesses between now and the end of March to help them with their costs. The tax warehousing scheme remains in place, but tax cannot be withheld forever. Businesses do have to pay their taxes. Members should bear in mind that some of that tax is PAYE, money that people earned a year or two ago that has not yet been paid to Revenue. In addition, we are seeing energy costs falling, which is encouraging. As regards VAT rates, for most of the past 30 years the VAT rate for hospitality has been between 12.5% and 13.5%. On a temporary basis, it was reduced to 9% after the financial crash and during Covid. In the run-up to the budget, we considered separating accommodation from food service. That is technically possible. It would take time to implement but the cost, unfortunately, ran into hundreds of millions of euro and, for that reason, a decision was made not to proceed with it. As regards Belcamp Manor, just like Deputy O'Callaghan and everybody else in the House, I do not like to see investment funds buying up family homes. We changed the law in 2021 to prevent that from happening. This particular permission was granted in 2019, two years before the law changed. Stamp duty is currently 10%. Clearly that did not deter the investment fund in this case from buying these homes. Sinn Féin is saying it should be 17% and the Social Democrats are saying 100%. That is not the way you do tax policy. We need to examine this properly-----	spk_115
#LeoVaradkar	2024-01-23	dail	33	Economic Policy	dbsect_6	-----work out what the effective amount would be and make sure we are very careful about any unintended consequences, which often happen in tax policy. Artificial intelligence is a really important topic to which we need to give a lot of consideration. It was the main topic of discussion in Davos last week. It is a powerful technology with potentially enormous benefits for society and the economy, but one that has some risks too. My only regret is that it is described as artificial intelligence. That gives people the impression it is something it is not. It is not anything approaching human intelligence. These are machines that can do calculations very fast.	spk_117
#LeoVaradkar	2024-01-23	dail	33	Economic Policy	dbsect_6	I will ask the Minister of State, Deputy Richmond, to revert to the Deputy on that issue.	spk_119
#LeoVaradkar	2024-01-23	dail	33	Covid-19 Pandemic	dbsect_7	I propose to take Questions Nos. 8 to 10, inclusive, together. A comprehensive evaluation of how the country managed Covid-19 will provide an opportunity to learn lessons from our experiences in dealing with the pandemic. It will include a review of the whole-of-government response to the pandemic and how we might do better and be in a stronger position if another pandemic or other similar event were to occur. It will include a consideration of the health service response, covering hospitals, the community and nursing homes, along with the wider economic and social response. It is intended to have a public element to hear the lived experiences of all of society. The review should be undertaken by those independent of the national response and with relevant expertise. A consultation with Opposition parties has been scheduled for this week and I intend to bring the terms of reference to Government shortly thereafter.	spk_120
#LeoVaradkar	2024-01-23	dail	33	Covid-19 Pandemic	dbsect_7	On Deputy Tóibín's questions, look, I was there in government both as Taoiseach and Tánaiste for that very dark period which was the pandemic. These were very difficult decisions to make. Everyone can be an expert in hindsight. We can only make decisions based on the information available and the advice that was put to us by experts. I have no doubt that the lockdowns saved lives. I am absolutely certain that the vaccine programme saved a lot of lives. We see that from the most recent OECD report, which shows that Ireland is one of only a handful of countries in which there were no excess deaths during that period, with only New Zealand, Iceland and Norway outperforming us. Of course the lockdowns had negative effects. I was among many people in government who were very clear about my concerns about the negative effects of lockdowns, not just on people's jobs and businesses but also delayed and deferred diagnoses, which the Deputy raised, which did happen. In housing construction we lost thousands of houses because of the housing construction lockdown.	spk_126
#LeoVaradkar	2024-01-23	dail	33	Covid-19 Pandemic	dbsect_7	Even for something like Garda numbers, if we had not closed Templemore there would be 1,000 more gardaí today. These things have real consequences but they were difficult decisions. It was never a case of choosing between the right option and the wrong option. It was choosing between options A, B and C, all of which had pros and cons.	spk_128
#LeoVaradkar	2024-01-23	dail	33	Covid-19 Pandemic	dbsect_7	Often those decisions were finely balanced. The public health advice more often than not was for deeper, longer, stricter lockdowns. That was often the view of the Opposition, too, indeed some even flirted with the bizarre zero Covid policy which has proven to be among the worst options when we see the effects that occurred, or certainly not a sustainable option as it was abandoned by all the countries that attempted it. In respect of Deputy Ó Murchú's questions about the terms of reference of the Covid inquiry, I am going to consult with Opposition leaders this week. I had hoped to do so in December but my diary just was not able to do it because of the amount of other obligations I have, particularly in relation to foreign travel. I hope that can go ahead this week. We will share the draft terms of reference with Opposition parties and discuss their views on the composition of them. Unfortunately I am not going to be in a position to engage personally with all of the different individual groups and stakeholders. We would never get this commission up and running. If it was possible to schedule that many meetings I would but I just cannot. We will find a mechanism to consult interested groups and stakeholders. On health service capacity, I agree that our health service needs more capacity, not least because of our rising population, our aging population and the development of new treatments. What Deputy Boyd Barrett did not acknowledge is that this is exactly what this Government has been doing since 2020, in the three or four years since we have been in office. We have 20,000 more staff in our health service now than we had in 2020. Yes, there are people leaving but there are way more people joining, 20,000 more in fact. We have 1,000 more consultants than we had in 2020. We have 1,000 more hospital beds than we had in 2020. We have more ICU beds and the Deputy is right that we are going to need a lot more. In terms of nurses we are now in the top five in the western world when it comes to practising nurses per head, even higher when it is practising nurses per bed. For the first time that I can remember, in the most recent statistics we are now around average in terms of the number of doctors that we have. We had been below average previously. There have been pay increases and we are in negotiations with public service unions about further pay increases. We would have liked to have that agreed back in October or November but it has not been possible. I do think that the utopian system, or perhaps the ideal system, to be fair, that Deputy Boyd Barrett describes sounds very like the NHS. It might have been a model that would have worked 50 or 100 years ago but it does not work in the modern world. What do we see in the NHS? We see longer waiting lists and waiting times for patients, lower life expectancy, worse outcomes when it comes to stroke and heart attack and lower pay for the staff.	spk_130
#LeoVaradkar	2024-01-23	dail	33	Covid-19 Pandemic	dbsect_7	That is definitely not a model that we will be following. In the election we will be encouraging people not to vote for Sinn Féin or for left wing parties precisely because that is what they want to do in Ireland. It is not a good thing. On long Covid, early in the pandemic the HSE identified a need for a national service for long Covid and to set up a multidisciplinary team to develop a model of care under the auspices of the chief clinical officer. The model of care is now being implemented building on existing service provision in addition to establishing new services across GP and community services and acute hospitals, to ensure a national service is in place for those who need it. Funding for the model of care has been increased to €6.6 million this year. At present there are six long Covid clinics and seven post-acute Covid clinics that are operating nationally. The clinics currently operate at St. Vincent's and Beaumont and the post-acute Covid clinics operating under the new model of care will be in the Mater and Connolly Hospital in Blanchardstown. In addition, Tallaght, St. James's Hospital, CUH, UHG and Limerick hospitals are operating combined post-acute and long Covid clinics. The HSE is working with Letterkenny to have a more definitive timeline around their anticipated launch date. Recruitment, which includes consultants in the areas of infectious disease, respiratory medicine, psychiatry, neurology and allied health professionals, clinical psychologists and administrators, is under way. To date 66 WTE primary notification numbers have been issued across all of the post-acute and long Covid clinics. As of 8 September last year, 46 whole-time equivalent posts had been followed. Deputies will appreciate that long Covid is an emerging area of medicine and expertise. There is still so much that we do not know about it.	spk_132
#LeoVaradkar	2024-01-23	dail	33	Covid-19 Pandemic	dbsect_7	I will be consulting with the Opposition parties on Thursday and am happy to go through it all then.	spk_134
#LeoVaradkar	2024-01-23	dail	33	Church-State Relations	dbsect_8	Like public representatives generally, I meet church leaders informally from time to time in the course of attending official or public events. The most recent formal meeting between the Office of the Taoiseach and the church leaders took place on 15 April 2021, when the now Tánaiste met the leaders of all the Christian churches, including the Roman Catholic Church, the Church of Ireland, the Presbyterian Church, the Methodist Church and the Irish Council of Churches. I had the opportunity to meet the papal nuncio shortly before Christmas. I understand that discussions at these forums covered the contribution to peace-building and the work churches undertake on an ongoing basis at community level in Northern Ireland in particular.	spk_136
