pid	date	house_code	house_no	debate_section_topic	debate_section_id	contribution	order_in_discourse
#LeoVaradkar	2024-01-30	dail	33	Cabinet Committees	dbsect_5	I thank the Deputies for their questions. Deputy Durkan raised the operation and layout of emergency departments. I very much agree with him that staff work very hard in emergency departments and are often subject to abuse and even violence from a minority of patients and their visitors and that is never acceptable. The NTPF is used to commission private healthcare for public patients and it generally works very well. However, patients do have the right to seek healthcare in Northern Ireland or in the EU and have the costs reimbursed. Ultimately, it is their choice. It would be better to use the capacity we have here in our private sector rather than people going abroad but they have that right under EU law. We also have an arrangement with Northern Ireland and people avail of that, particularly for cataracts. Regarding the recruitment freeze and embargo, provision has been made for the HSE to increase its staff this year. It can hire an additional 2,000 staff. Since 2020, we have seen a recruitment surge. We have 8,000 more nurses and midwives than we had in 2020 and there are 3,000 more doctors and dentists. The HSE can hire an additional 2,000 staff but it needs to be done in a proper way. Deputies Moynihan and Murphy asked about drugs policy. I met the chairman of the Citizens' Assembly on Drug Use last week. There were three takeaways for me from what he said. The first is that we need an Irish model; we should not just try to copy models in other countries. The assembly has made a lot of recommendations and it is not just about decriminalisation. He does not want all the focus to be on that. If it is going to be examined by an Oireachtas committee, it should be a special committee, not the health or justice committees because it is relevant to both areas and indeed other areas like education. Our intention is to refer the report to a special Oireachtas committee. The Minister, Deputy Naughton, will bring a memo to Cabinet about that next week. One of the issues the special Oireachtas committee will have to tease is what decriminalisation really means in Ireland in a legal context. Does it mean that is not an offence at all? Does it meant that it is a non-indictable offence? Does it mean that it is an offence without a penalty? Is there something like penalty points or does it actually mean that a certain amount of each particular substance would not be illegal to possess? All of this has to be teased out by the committee. It was not teased out by the assembly. In fairness to the members, they are not legal experts or legislators. With that in mind, we are proposing a timed amendment of nine months to the Private Members' Bill. Deputy Boyd Barrett mentioned a particular medication or cream that I am not familiar with. I do not know why it was taken off the GMS and the DPS. There may well be a good reason and there may not be. If the Deputy can pass me a note with the name of the medicine, I will check up on it because I am sure the issue will come up again. Deputy Tóibín asked about access to GP services. We have increased the number of training places dramatically. There are now more doctors qualifying as GPs than there are retiring. It does not take six, seven or eight years. If people train as a GP, in their third year of training they are in practice almost full time, seeing patients. We are seeing those people come through already. We are allowing GPs to come in from other jurisdictions and South Africa in particular. This is because it is an international labour market and people come and go. We are also investing in more practice nurses because in Ireland there is a very low ratio of nurses to GPs. In an Irish general practice, there might be one nurse to four doctors. In a general practice in Holland, there will usually be four nurses and four doctors. That model works very well, so they are the things we are doing. Ozempic is a medicine used both for diabetes and obesity. We should not forget that obesity is a disease. It is good that treatments are now available for it. However, there is a shortfall of supply internationally and for that reason, and rightly so, diabetic patients are being prioritised. The company, Novo Nordisk, is scaling up production, but thinks that it will be the latter part of the year before enough is being produced to meet demand. Finally, to Deputy O'Sullivan's question, I will check up on the heel prick test. I do not know what the current status of the review is. I know we test for many more things than we used to. It used to be just four and now it is approximately 60. I am not exactly sure where we are on that but I will follow up on it. I also want to recognise Deputy's advocacy when it comes to new medicines and rare diseases. As part of the Revised Estimates Volume just before Christmas, we set aside dedicated funding for new medicines for this year. Hopefully, that will see more new medicines and more new uses being approved throughout 2024.	spk_105
#LeoVaradkar	2024-01-30	dail	33	Cabinet Committees	dbsect_5	The HSE can recruit an additional 2,000 staff this year.	spk_107
#LeoVaradkar	2024-01-30	dail	33	Cabinet Committees	dbsect_5	I propose to take Questions Nos. 13 to 23, inclusive, together. The Cabinet committee on housing met yesterday. The committee works to ensure a co-ordinated approach to the implementation of Housing for All and programme for Government commitments regarding housing and related matters. Our latest update on progress achieved under Housing for All was published last Thursday. Despite considerable challenges in the external environment, we are making real progress with new homes and apartments being built all over the country.  Last week, data released by the CSO confirmed that more houses were built last year than in any year since 2008. That is a 15-year high. With more than 32,000 new homes, our target for 2023 has been exceeded. We are confident that this strong momentum will continue, with building under way on almost 33,000 new homes last year, which is up 20% on the previous year. Planning permission data also indicates a strong pipeline, with permission granted for more than 37,600 new homes in the year to the end of September 2023.  Affordability initiatives are having a real impact in helping people to achieve home ownership, with more than 500 first-time buyers or couples drawing down their mortgage each week. This is the highest since 2007.Almost 2,500 couples and individuals availed of the first home scheme in 2023, while in the 11 months to the end of November 2003, almost 7,000 claimed the help-to-buy scheme to assist with the deposit needed to purchase or build a new home. These schemes will assist thousands more to buy this year. We are also seeing the benefit of recent measures to bring vacant and derelict homes back into use, with just over 3,000 applications approved for the vacant property refurbishment grant. On State lands, building started on a number of sites during the final months of 2023. This includes almost 2,000 new homes in the Dublin City Council area and over 200 new social and affordable homes at the former Devoy Barracks in Naas. We are also committed to improving the rental market by providing greater security, affordability and viability to tenants and landlords into the future. In addition to the increased rent tax credit, recent measures to bring about more homes to rent include further reform of the fair deal scheme and the Government's new policy to develop more on-campus student accommodation. Housing for All is working. We are building more homes and we need to press ahead with implementation and maintain this strong momentum into 2024 and beyond.	spk_108
#LeoVaradkar	2024-01-30	dail	33	Cabinet Committees	dbsect_5	Deputy Durkan raised the issue of institutional investors. The Government recognises the need for protections to prevent institutional investors displacing owner occupiers. For this reason, we introduced tax and planning changes to protect traditional family houses from bulk purchase. These include changes introduced in May 2021 to the rate of stamp duty on bulk purchases. A 10% stamp duty levy was introduced by Government for the cumulative purchase of ten or more residential houses in a 12-month period. Section 28 guidelines for planning authorities provide for an owner occupier guarantee preventing multiple units being sold to a single buyer in new estates, although, of course, this does not apply retrospectively to permissions granted before 2021. About 40,000 homes have received planning permission with conditions attached prohibiting bulk purchase or multiple sale to a single purchaser since that law was brought in and we are considering further measures. We believe the role of institutional investors is to finance new housing developments that otherwise would not be built, not to buy up existing ones when people have a legitimate expectation that they may be able to buy them themselves. Deputy Dillon raised the issue of affordable housing schemes in Mayo. I agree that we need a mix of affordable housing schemes and social housing schemes. It should not just be social housing. The argument made in the past was that counties where affordability is better than others do not need these schemes. I do not agree with that view. I think every county should have at least one scheme but I would also point out that there are ways other than affordable housing schemes to achieve affordability. Help to buy does it by helping people to afford a deposit and the first home scheme can close the gap between what somebody gets in terms of mortgage approval and the cost of building a new home. There are lots of ways we can achieve affordability. Social housing is clearly one way. As I said before, it benefits everyone. It takes people off the housing list, frees up properties for other people to rent and has a downward dampening effect on house prices. That is why we are building more social housing now than at any point since the 1970s. The Deputy may be interested to know that if we compare the 2022 census with the census ten years ago, we find that there are 40,000 more families on social housing than was the case back in 2011 and the percentage of people living in social housing is now higher than it was ten years ago. That shows how committed this Government and previous Governments in the past ten years have been to social housing. We are also trying to reduce the cost of building homes by waiving development levies, servicing more land, reducing the cost of finance and focusing on vacancy and help to buy. Let us never forget what help to buy is. This is tax that people have already paid. It is their own tax they are getting back and they can put it towards their deposit. It would be terrible if that was taken away. Regarding the Vienna model, Vienna is a great city. I have been there many times and I love the place but there are merits and demerits to its housing model. One of the things people in Vienna tell me is that because there is such a focus on public housing, it is very hard to own your own home in Vienna. Home ownership rates in Austria are among the lowest in Europe and are lower than they are in Ireland. I am not sure if that is the model people want in Ireland, one where people are less likely to own their own home and are in public housing for life no matter how good and secure it may be. I think we all appreciate that there will always be some level of vacancy but there is still too much of it. It is still too common even though vacancy rates are falling. I agree with Deputy Barry that local authorities need to be more assertive and proactive in what they do regarding vacancy. Some are better than others. Waterford is a very good example of a local authority that is particularly active when it comes to vacancy and other local authorities could learn from that. The Government is adopting a carrot-and-stick approach. A figure of €150 million is available to local authorities to purchase derelict properties and bring them back into use. They can buy the property, sell it on and use the money again to buy another property. I am really encouraging local authorities to do that. They have compulsory purchase order powers that are not used enough. There is the derelict site levy, which they are often too slow to impose, and there is the vacant property tax. Grants are now available to individuals to renovate properties and bring them back into use. Over 3,000 of those have been approved and the drawdown is picking up. Deputy Pádraig O'Sullivan raised the issue of a social housing passport. I will have to come back to him on that issue. It is a good idea, particularly where people are moving back to their own county, that they would carry their years with them. One thing we would need to guard against is people being on multiple lists because it could create all sorts of difficulties if people are on housing lists in several different local authorities. I do not have any information for Deputy Tóibín regarding the issue he raised concerning the Land Registry. There are, however, lots of options available to people who are still in financial distress from the crash 12 or 13 years ago. Mortgage to rent is one option while personal insolvency is another option. I would say to anyone to get good legal and financial advice on their options. The Minister of State, Deputy O'Donnell, made a statement on the housing adaptation grant earlier in the Dáil today. That is probably a more up-to-date response than I can give.	spk_117
#LeoVaradkar	2024-01-30	dail	33	Cabinet Committees	dbsect_5	I propose to take Questions Nos. 24 to 27, inclusive, together. The Government has established ten Cabinet committees. These are Brexit and Northern Ireland, children and education, economy and investment, environment and climate change, EU and international affairs, Government co-ordination, health, housing, humanitarian response to Ukraine, and social affairs and public services. I am a member of all committees, as are the Tánaiste and the Minister for the Environment, Climate and Communications, Deputy Ryan. That is an awful lot of committees, so if anybody has a new committee or task force they think I should chair, I would appreciate suggestions on ones I should stop chairing.	spk_118
#LeoVaradkar	2024-01-30	dail	33	Cabinet Committees	dbsect_5	On the St. Patrick's Day events in the White House, I have not yet received an invitation. If I am invited, I will accept and, as always, use it as an opportunity to speak to the US President and Administration about matters of interest and concern to the Irish people. Those conversations are not always pleasant ones. While we agree on the majority of things, we do not agree on everything. I point out that the President of Palestine, Mahmoud Abbas, has met President Biden in the past few months, and certainly more recently than I have met him. I do not think the President of Palestine would refuse an invitation to go to the White House to discuss matters happening in Gaza and elsewhere. I do not see why we would do so, on that basis. With regard to the International Court of Justice, we support and accept the rulings it has made in recent weeks. We believe Israel must now implement those and protect civilian life. It is important to clarify that the ICJ has not found that Israel has committed genocide, nor has it called for ceasefire - we have. It has found that South Africa has a valid and plausible case to make. South Africa informs us it is preparing the case. It could be between three and four months before that case is ready to submit. At that point, it will be possible for us to make an intervention, either under section 62 or section 63. These are different types of intervention. It is not a matter of joining the case. That is a misnomer. It is not like signing a petition or liking a tweet. It is much more complicated than that. We would have to look at it carefully and in detail. We also need to bear in mind that there is no guarantee that the ICJ will find Israel guilty of genocide in two or three years' time. We need to make sure we are not on the wrong side of the law and the facts on this.	spk_123
#LeoVaradkar	2024-01-30	dail	33	Cabinet Committees	dbsect_5	Of course. We are getting our own legal advice.	spk_125
#LeoVaradkar	2024-01-30	dail	33	Cabinet Committees	dbsect_6	I propose to take Questions Nos. 1 to 12, inclusive, together. The Cabinet committee on health last met on 7 December 2023 and is currently scheduled to next meet on 12 February of this year. The committee oversees the programme for Government commitments relating to health and receives detailed reports on identified policy areas. It considers the progress of health reforms, including Sláintecare and the reform of disability services. The committee also maintains an overview of public health. In addition to the meetings of the full Cabinet and Cabinet committees, I meet Ministers from time to time on an individual basis to focus on different issues. I meet regularly with the Minister for Health to discuss progress and challenges in health, including the Sláintecare reform programme. Sláintecare, which is happening with the support and oversight of the Department of the Taoiseach through the Cabinet committee on health, is about four main issues: making healthcare more affordable; making it more accessible; ensuring better outcomes for patients; and reforming our health service. We are committed to expanding the core capacity of our acute hospitals, with more health professionals and more acute hospital beds.We have added more than 1,000 permanent beds in our acute hospitals since 2020 and 1,000 more consultants. We have increased the total public health sector workforce by more than 26,000 since the start of 2020. That includes an extra 8,000 nurses and midwives, an extra 4,000 social care professionals and almost 3,000 extra doctors and dentists. There is a strong pipeline of capital projects, including several new hospital projects and significant new facilities for existing hospitals. Our multi-annual approach to waiting lists resulted in an overall reduction in the number of patients waiting more than ten to 12 weeks by 27% since the numbers peaked after the pandemic. Waiting lists fell last year for the second year in a row. We are determined to make sure they fall for the third year in a row this year. The figures that matter most are the number of patients waiting the longest, that is, those waiting longer than the ten to 12 weeks recommended by the Sláintecare report. The target of achieving a 10% reduction in patients waiting longer than ten to 12 weeks was met, with an 11% reduction achieved. This covers inpatients, day cases, outpatients and patients undergoing gastrointestinal, GI, scopes, and equates to 57,000 fewer people waiting more than ten to 12 weeks. The enhanced community care programme continues to improve healthcare at a more local level and to alleviate pressure on major hospitals. The majority of community healthcare networks, community intervention teams and community support teams are now in place and providing care closer to home. Work is ongoing on the reconfiguration of the HSE organisational structures into six new health regions and the establishment of elective care centres in Dublin, Cork and Galway, as well as surgical hubs in Dublin, Cork, Galway, Limerick and Waterford in the interim. At a time when the cost-of-living crisis is affecting everyone, we are making healthcare more affordable through the removal of hospital charges, widened eligibility for the GP card and a reduced drug payment scheme threshold, among other measures. We have allocated more than €22.8 billion for health services in 2024. That will facilitate the continued provision and expansion of quality, affordable healthcare services. Separately, significant funding is also being invested in disability services. Budget 2024 will provide for the further expansion of free contraception provision to include women aged 31; just under €3 million for the development of child and adolescent mental health services, CAMHS, with the creation of 68 new posts; the first full-year programme of publicly funded assisted human reproduction services, including IVF; more than €20 million for residential placements for children and adults; €15 million for respite services, €18.2 million for day services; and €8.5 million for developments in children's services, including new therapy assistant positions. Our health service has its challenges but it is responding and it has expanded dramatically in recent years. We are treating more people with better outcomes than ever before. Our life expectancy is continuing to increase and is now well above international averages, being in the top five in the European Union. We continue to reduce mortality rates for stroke and certain cancers and to report ever-increasing positive trends in preventative health.	spk_96
